### ISSUE TITLE
Network traffic when recorded data is available

### ISSUE THREAD

**Issue by matsduf** [zonemaster/zonemaster-backend#828]
Data has been recorded with the following command:
```
$ ZONEMASTER_RECORD=1 PERL_DL_NONLAZY=1 "/usr/bin/perl" "-MExtUtils::Command::MM" "-MTest::Harness" "-e" "undef *Test::Harness::Switches; test_harness(0, 'inc', 'blib/lib', 'blib/arch')" t/test01.t
t/test01.t .. # database: SQLite
# recording
(...)
t/test01.t .. ok    
All tests successful.
Files=1, Tests=39, 41 wallclock secs ( 0.03 usr  0.00 sys + 13.10 cusr  0.41 csys = 13.54 CPU)
Result: PASS
```
A new `t/test01.data` has been created. The test is rerun without recording:
```
$ PERL_DL_NONLAZY=1 "/usr/bin/perl" "-MExtUtils::Command::MM" "-MTest::Harness" "-e" "undef *Test::Harness::Switches; test_harness(0, 'inc', 'blib/lib', 'blib/arch')" t/test01.t 
t/test01.t .. # database: SQLite
# not recording
(...)
All tests successful.
Files=1, Tests=39, 18 wallclock secs ( 0.03 usr  0.01 sys + 10.99 cusr  0.21 csys = 11.24 CPU)
Result: PASS
```
Still there is a lot of DNS traffic connected to the tests:
```
15:56:04.309556 IP 10.40.6.10.47471 > 192.134.4.1.53: 8072 SOA? wWW.AFNiC.fr. (30)
15:56:04.345967 IP 192.134.4.1.53 > 10.40.6.10.47471: 8072*- 0/1/0 (101)
15:56:04.357497 IP 10.40.6.10.48376 > 192.93.0.4.53: 21441 SOA? wWW.AFNiC.fr. (30)
15:56:04.399185 IP 192.93.0.4.53 > 10.40.6.10.48376: 21441*- 0/1/0 (101)
15:56:04.413468 IP 10.40.6.10.46942 > 192.134.0.49.53: 21660 SOA? wWW.AFNiC.fr. (30)
15:56:04.455356 IP 192.134.0.49.53 > 10.40.6.10.46942: 21660*- 0/1/0 (101)
15:56:04.481177 IP 10.40.6.10.47348 > 192.134.4.1.53: 26113 SOA? www.aFNiC.Fr. (30)
15:56:04.516828 IP 192.134.4.1.53 > 10.40.6.10.47348: 26113*- 0/1/0 (101)
15:56:04.524484 IP 10.40.6.10.38446 > 192.134.4.1.53: 1966 SOA? wWW.aFnic.Fr. (30)
15:56:04.560493 IP 192.134.4.1.53 > 10.40.6.10.38446: 1966*- 0/1/0 (101)
15:56:04.578578 IP 10.40.6.10.44382 > 192.93.0.4.53: 7715 SOA? www.aFNiC.Fr. (30)
15:56:04.619929 IP 192.93.0.4.53 > 10.40.6.10.44382: 7715*- 0/1/0 (101)
15:56:04.633223 IP 10.40.6.10.49629 > 192.93.0.4.53: 3 SOA? wWW.aFnic.Fr. (30)
15:56:04.674584 IP 192.93.0.4.53 > 10.40.6.10.49629: 3*- 0/1/0 (101)
15:56:04.684784 IP 10.40.6.10.42333 > 192.134.0.49.53: 19696 SOA? www.aFNiC.Fr. (30)
15:56:04.726485 IP 192.134.0.49.53 > 10.40.6.10.42333: 19696*- 0/1/0 (101)
15:56:04.737497 IP 10.40.6.10.56099 > 192.134.0.49.53: 10641 SOA? wWW.aFnic.Fr. (30)
15:56:04.779341 IP 192.134.0.49.53 > 10.40.6.10.56099: 10641*- 0/1/0 (101)
15:56:05.751313 IP 10.40.6.10.60874 > 202.12.27.33.53: 51937 SOA? xa. (20)
15:56:05.785622 IP 202.12.27.33.53 > 10.40.6.10.60874: 51937 NXDomain*- 0/1/0 (95)
15:56:05.882207 IP 10.40.6.10.56130 > 192.134.4.1.53: 25295 SOA? xa. (20)
15:56:05.917971 IP 192.134.4.1.53 > 10.40.6.10.56130: 25295 Refused- 0/0/0 (20)
15:56:05.956934 IP 10.40.6.10.51697 > 192.134.4.1.53: 25743 NS? xa. (20)
15:56:05.992963 IP 192.134.4.1.53 > 10.40.6.10.51697: 25743 Refused- 0/0/0 (20)
15:56:06.051775 IP 10.40.6.10.55928 > 192.134.4.1.53: 27238 A? www.xa. (24)
15:56:06.087888 IP 192.134.4.1.53 > 10.40.6.10.55928: 27238 Refused- 0/0/0 (24)
```

Is this an issue for Zonemaster-Engine?

**Comment by pnax** [comment]
> Is this an issue for Zonemaster-Engine?

Yes it is. I think that this comes from the fact that in `Nameserver08` and `Nameserver09`, we are randomly altering the query name case. There seems to also be a leak with `Nameserver03`, I guess we are not storing the AXFR response. I've open an issue, see https://github.com/zonemaster/zonemaster-engine/issues/951.

**Comment by matsduf** [comment]
> Yes it is. I think that this comes from the fact that in `Nameserver08` and `Nameserver09`, we are randomly altering the query name case.

I do not think there is a strong reason to have a random alternation between upper and lower case. There could be a few fixed patterns.

**Comment by matsduf** [comment]
This issue is handled in Engine,  zonemaster/zonemaster-engine#951
